{
  "proverVersion": "4.0.0-riscv",
  "proof": "0xdeadbeef",
  "startBlockNumber": 1000501,
  "publicInputs": {
    "endBlockNumber": 1000520,
    "endBlockTimestamp": 1763000457,
    "endL1L2BridgeRollingHash": "0x3333333333333333333333333333333333333333333333333333333333333333",
    "endL1L2BridgeRollingHashMessageNumber": 7,
    "dynamicChainConfigHash": "0xc0c0c0c0c0c0c0c0c0c0c0c0c0c0c0c0c0c0c0c0c0c0c0c0c0c0c0c0c0c0c0c0",
    "parentFtxRollingHash": "0x4444444444444444444444444444444444444444444444444444444444444444",
    "parentFtxNumber": 7,
    "endFtxRollingHash": "0x5555555555555555555555555555555555555555555555555555555555555555",
    "endProcessedFtxNumber": 9,
    "parentDataRollingHash": "0x4747474747474747474747474747474747474747474747474747474747474747",
    "endDataRollingHash": "0x8d8d8d8d8d8d8d8d8d8d8d8d8d8d8d8d8d8d8d8d8d8d8d8d8d8d8d8d8d8d8d8d",
    "parentBlockHash": "0x0a0a0a0a0a0a0a0a0a0a0a0a0a0a0a0a0a0a0a0a0a0a0a0a0a0a0a0a0a0a0a0a",
    "endBlockHash": "0x0b0b0b0b0b0b0b0b0b0b0b0b0b0b0b0b0b0b0b0b0b0b0b0b0b0b0b0b0b0b0b0b",
    "parentDataTailTakeBytes": 0,
    "finalDataTailDiscardBytes": 0,
    "l2L1TreeDepth": 5,
    "l2L1Roots": [
      "0x653b4727bb7c5a399279c43baa435a3f9eaf400982d6206e569662ea02666ab2"
    ],
    "filteredAddresses": [
      "0x0101010101010101010101010101010101010101"
    ],
    "programIds": [
      "0x1111111111111111111111111111111111111111111111111111111111111111",
      "0x2222222222222222222222222222222222222222222222222222222222222222"
    ],
    "l2MessagingBlocksOffsets": []
  }
}
